{
  "schema": "xcodebuildmcp.output.build-run-result",
  "schemaVersion": "1",
  "didError": false,
  "error": null,
  "data": {
    "request": {
      "scheme": "CalculatorApp",
      "workspacePath": "example_projects/iOS_Calculator/CalculatorApp.xcworkspace",
      "configuration": "Debug",
      "platform": "iOS Simulator",
      "simulatorName": "iPhone 17"
    },
    "summary": {
      "status": "SUCCEEDED",
      "durationMs": 1234,
      "target": "simulator"
    },
    "artifacts": {
      "appPath": "<HOME>/Library/Developer/XcodeBuildMCP/DerivedData/Build/Products/Debug-iphonesimulator/CalculatorApp.app",
      "bundleId": "io.sentry.calculatorapp",
      "processId": 99999,
      "simulatorId": "<UUID>",
      "buildLogPath": "<HOME>/Library/Developer/XcodeBuildMCP/logs/build_run_sim_<TIMESTAMP>_pid<PID>.log",
      "runtimeLogPath": "<HOME>/Library/Developer/XcodeBuildMCP/logs/io.sentry.calculatorapp_<TIMESTAMP>_pid<PID>.log",
      "osLogPath": "<HOME>/Library/Developer/XcodeBuildMCP/logs/io.sentry.calculatorapp_oslog_<TIMESTAMP>_pid<PID>.log"
    },
    "diagnostics": {
      "warnings": [],
      "errors": []
    }
  }
}
