{
  "schema": "xcodebuildmcp.output.build-run-result",
  "schemaVersion": "1",
  "didError": false,
  "error": null,
  "data": {
    "request": {
      "packagePath": "<ROOT>/example_projects/spm",
      "executableName": "spm",
      "target": "swift-package"
    },
    "summary": {
      "status": "SUCCEEDED",
      "durationMs": 1234,
      "target": "swift-package"
    },
    "artifacts": {
      "packagePath": "<ROOT>/example_projects/spm",
      "executablePath": "<ROOT>/example_projects/spm/.build/arm64-apple-macosx/debug/spm",
      "processId": 99999,
      "buildLogPath": "<HOME>/Library/Developer/XcodeBuildMCP/logs/build_run_spm_<TIMESTAMP>_pid<PID>.log"
    },
    "output": {
      "stdout": [
        "Hello, world!"
      ],
      "stderr": [
        "Building for debugging...",
        "[0/6] Write sources",
        "[1/6] Write spm-entitlement.plist",
        "[2/6] Write swift-version--6988338F2F200930.txt",
        "[4/8] Compiling spm main.swift",
        "[5/8] Emitting module spm",
        "[5/8] Write Objects.LinkFileList",
        "[6/8] Linking spm",
        "[7/8] Applying spm",
        "Build of product 'spm' complete! (<DURATION>)"
      ]
    },
    "diagnostics": {
      "warnings": [],
      "errors": []
    }
  }
}
