{
  "schema": "xcodebuildmcp.output.build-run-result",
  "schemaVersion": "1",
  "didError": false,
  "error": null,
  "data": {
    "request": {
      "scheme": "CalculatorApp",
      "workspacePath": "example_projects/iOS_Calculator/CalculatorApp.xcworkspace",
      "configuration": "Debug",
      "platform": "iOS",
      "deviceId": "<UUID>",
      "target": "device"
    },
    "summary": {
      "status": "SUCCEEDED",
      "durationMs": 1234,
      "target": "device"
    },
    "artifacts": {
      "appPath": "<HOME>/Library/Developer/XcodeBuildMCP/DerivedData/CalculatorApp-<HASH>/Build/Products/Debug-iphoneos/CalculatorApp.app",
      "bundleId": "io.sentry.calculatorapp",
      "processId": 99999,
      "deviceId": "<UUID>",
      "buildLogPath": "<HOME>/Library/Developer/XcodeBuildMCP/logs/build_run_device_<TIMESTAMP>_pid<PID>.log"
    },
    "diagnostics": {
      "warnings": [],
      "errors": []
    }
  }
}
